{
    "$schema" : "http://json-schema.org/draft-03/schema",
    "title" : "material",
    "type" : "object",
    "description" : "TODO",
    "properties": {    
        "name" : {
            "type" : "string",
            "description" : "The externally-referenceable globally-unique name of this node."
        },
        "parameters" : {
	        "$ref" : "parameters.schema.json"
        },
        "technique" : {
            "type" : "string",
            "description" : "The name of the default technique referenced by this material.",
            "required" : true
        },
        "techniques" : {
            "description" : "The techniques available to this material.",
            "properties" : {
            },
            "additionalProperties" : {
                "$ref" : "technique.schema.json"
            },
            "required" : true
        },
        "extra" : {
            "type" : "any",
            "description" : "Optional application-specific data."
        }
    },
    "additionalProperties" : false
}
