{
    "name" : "application-visible globally-unique name",
    "parameters" : {
    },
    "technique" : "exampleTechnique",
    "techniques" : {
		"exampleTechnique" : {
		    "pass" : {
			    "program" : {
					"attributes" : [{
				    	"symbol" : "position",
				    	"type" : "vec3"
					}],
					"fragmentShader" : "fragmentShader_id",
					"vertexShader" : "vertexShader_id"
			    }
			}
		}
    },
    "extra" : {
       "Application specific" : "The extra object can contain any properties."
    }     
}
